{
  "schemaVersion": 1,
  "sourceCommit": "e8b43e86222efb7503b4b1089059ed0c187f98f9",
  "status": "accepted",
  "screenshots": [
    "media-detail-chromium-400-zoom-chromium-400-zoom-linux.png",
    "media-detail-chromium-compact-chromium-compact-linux.png",
    "media-detail-chromium-desktop-chromium-desktop-linux.png",
    "media-detail-chromium-high-contrast-chromium-high-contrast-linux.png",
    "media-detail-chromium-light-chromium-light-linux.png",
    "media-detail-chromium-rtl-chromium-rtl-linux.png",
    "media-library-chromium-400-zoom-chromium-400-zoom-linux.png",
    "media-library-chromium-compact-chromium-compact-linux.png",
    "media-library-chromium-desktop-chromium-desktop-linux.png",
    "media-library-chromium-high-contrast-chromium-high-contrast-linux.png",
    "media-library-chromium-landscape-touch-chromium-landscape-touch-linux.png",
    "media-library-chromium-large-text-chromium-large-text-linux.png",
    "media-library-chromium-light-chromium-light-linux.png",
    "media-library-chromium-phone-dpr3-chromium-phone-dpr3-linux.png",
    "media-library-chromium-reduced-motion-chromium-reduced-motion-linux.png",
    "media-library-chromium-rtl-chromium-rtl-linux.png",
    "media-library-chromium-tablet-chromium-tablet-linux.png",
    "media-library-chromium-ultrawide-chromium-ultrawide-linux.png",
    "media-picker-chromium-400-zoom-chromium-400-zoom-linux.png",
    "media-picker-chromium-compact-chromium-compact-linux.png",
    "media-picker-chromium-desktop-chromium-desktop-linux.png",
    "media-picker-chromium-high-contrast-chromium-high-contrast-linux.png",
    "media-picker-chromium-light-chromium-light-linux.png",
    "media-picker-chromium-rtl-chromium-rtl-linux.png"
  ],
  "assertions": {
    "overflow": "pass",
    "focus": "pass",
    "accessibility": "pass",
    "console": "pass",
    "requests": "pass",
    "targets": "pass"
  }
}
